factor_id,powertrain,trailer_type,refrigeration_mode,co2_g_per_ton_mile,co2_g_per_mile,default_payload_tons,kwh_per_mile_tract,kwh_per_mile_tru,grid_co2_g_per_kwh,source_id,source_page,status,notes
diesel_dryvan_none,diesel,dry_van,none,105,1784,16.35,,,,smartway_olt_2025,p13 Table 3; p14 Table 4,OK,Diesel baseline from SmartWay OLT Non-SmartWay TL Dry Van.
diesel_refrigerated_diesel_tru,diesel,refrigerated,diesel_tru,109,2066,17.60,,,,smartway_olt_2025,p13 Table 3; p14 Table 4,OK,Diesel refrigerated baseline from SmartWay OLT Non-SmartWay Refrigerated.
diesel_refrigerated_electric_tru,diesel,refrigerated,electric_tru,,1784,16.35,,,,epri_etru_market_tech_assessment,p2-28,OK,Diesel tractor plus electric TRU increment computed at runtime from eTRU power terms and grid CI.
bev_dryvan_none,bev,dry_van,none,,,16.35,2.67,0,,nacfe_rol_electric_2024,p57 Figure 34,OK,BEV traction energy terms from NACFE RoL-E Class 8 tractor consumption.
bev_refrigerated_electric_tru,bev,refrigerated,electric_tru,,,16.35,2.67,,,epri_etru_market_tech_assessment,p2-28,OK,BEV refrigerated case uses traction plus electric TRU energy terms at runtime.
bev_refrigerated_diesel_tru,bev,refrigerated,diesel_tru,,,16.35,2.67,0,,nacfe_rol_electric_2024,p57 Figure 34,NEEDS_SOURCE_VALUE,Hybrid BEV + diesel TRU requires dedicated field evidence before REAL_RUN.
