factor_id,powertrain,trailer_type,refrigeration_mode,co2_g_per_ton_mile,co2_g_per_mile,default_payload_tons,kwh_per_mile_tract,kwh_per_mile_tru,grid_co2_g_per_kwh,source_id,source_page,status,notes
diesel_dryvan_none,diesel,dry_van,none,105,1784,16.35,,,,smartway_olt_2025,p13 Table 3; p14 Table 4,OK,Non-SmartWay TL/Dry Van factors.
diesel_refrigerated_diesel_tru,diesel,refrigerated,diesel_tru,109,2066,17.60,,,,smartway_olt_2025,p13 Table 3; p14 Table 4,OK,Non-SmartWay Refrigerated factors.
diesel_refrigerated_electric_tru,diesel,refrigerated,electric_tru,,,,,,,tru_realworld_refrigerated_road_2023,,MISSING_TRU_ELECTRIC_INTENSITY,Need electric TRU-on-diesel-tractor intensity assumptions from literature extraction.
bev_dryvan_none,bev,dry_van,none,,,,,,,bev_refrig_energy_methods_2025,,MISSING_BEV_INTENSITY,Need BEV traction kWh/mi and payload-linked conversion assumptions.
bev_refrigerated_electric_tru,bev,refrigerated,electric_tru,,,,,,,bev_refrig_thermal_power_model_2025,,MISSING_BEV_INTENSITY,Need BEV refrigerated kWh/mi traction and electric-TRU kWh/mi estimates.
bev_refrigerated_diesel_tru,bev,refrigerated,diesel_tru,,,,,,,bev_refrig_energy_methods_2025,,MISSING_BEV_INTENSITY,Scenario defined for completeness; intensity values unresolved.
